SKU,Title,Variant,Type,Tags (Features/Applications),Price,Compare At Price,Description (Use/Features)
DK_CSSG,Cica + 1% Salicylic Acid Exfoliating Shower Gel,250ml,bodycare,"_allproducts, _Body Care, activeAcne, body wash, bodywash, bundle, category_Singles, clinical-single-revised, exclusion_app, kojic, label_15_off_flat15, label_buy_1_get_1, NewYearStore_, Oily Skin, proneAcne, revised-ing-a, score:33, Sensitive Skin, skinconcern_Clogged Pores, skinconcern_Open Pores, skinconcern_Pore Care, skintype_Oily, st_ingredients_niacinamide, st_ingredients_salicylic, st_skin_type_oily, st_skin_type_sensitive",399.00,399.00,"Sulphate-free daily gentle exfoliating shower gel for calm, acne-free skin. Infused with Cica, 1% Salicylic Acid, Green Tea &amp; Niacinamide. Visibly reduces body acne , soothes inflammation &amp; fades dark spots Unclog pores of excess oil while treating uneven, bumpy skin texture Non-drying formula , gel to luxurious foaming shower gel for oily, acne-prone &amp; sensitive skin Gently exfoliates Non-Drying Sulphate-Free OILY, ACNE-PRONE, SENSITIVE SKIN cica-shower-gel Tried. Tested. Loved. 94 saw visible reduction in body acne in 4 weeks of users saw a visible reduction in dark circles* in 4 weeks 94 saw visible reduction in body acne in 4 weeks *self assessment study conducted with 36 subjects over 4 weeks Results In Clean, Smooth &amp; Acne-Free Skin Results In Clean, Smooth &amp; Acne-Free Skin Benefits Visibly reduces body acne Unclog pores of excess oil &amp; dirt Soothes redness &amp; irritation Gel to luxurious foam texture Sulphate-free, non-drying formula Who is it for? Body Acne Redness &amp; Irritation Dark Spots Bumpy, Uneven Skin Texture Skin Types Oily Acne-Prone &amp; Sensitive Skin 1% SALICYLIC ACID Gently exfoliates &amp; unclogs pores of dirt &amp; impurities. CICA Soothes redness, irritation &amp; inflammation caused due to body breakouts. NIACINAMIDE Treats dark spots &amp; uneven skin tone all over the body. GREEN TEA Fights acne-causing bacteria to reduce breakout frequency. 1% Salicylic Acid, Cica, Niacinamide, Green Tea Aqua, Potassium Laureth Phosphate, Sodium Cocoyl Glycinate, Sodium C14-16 Olefin Sulfonate, Polyacrylate - 33, Disodium Cocoamphoacetate, Cocamidopropyl Betaine, IFRA Certified Allergen Free Fragrance, Salicylic Acid, Niacinamide, Centella Asiatica (Cica) Extract, Camellia Sinensis (Green Tea) Leaf Extract, Citric Acid, Phenoxyethanol (and) Ethylhexylglycerin (and) Octenidine HCl, Glycerine, PEG-7 Glyceryl Cocoate, Disodium EDTA. Pour a generous amount on your hand or loofah Gently rub &amp; work it into a rich lather Rinse off &amp; towel dry Q. How often do I need to use this salicylic acid shower gel? A. Our 1% Salicylic Body Shower Gel is sulphate-free &amp; non-drying which makes it gentle enough to be used every day. However, you can start using it 2-3 times a week initially &amp; slowly build up to using it daily. Q. Do I need to moisturize my skin after using this shower gel? A. Yes. Even though our shower gel is sulphate-free &amp; non-drying, to help retain your skin's natural moisture, we recommend using a body lotion post cleansing your body with this shower gel. Q. In how many weeks will I see the results? A. You'll start seeing the results within 4 weeks of using this shower gel daily. Q. Can I use it for my face too? A. No. Our 1% Salicylic Shower Gel is made to suit your body skin. However, you can try our Cica Calming Facewash with 2% Salicylic Acid to treat acne, treat &amp; irritation on your face. Q. Do I need to leave the shower gel for some time before rinsing it off? A. No. You do not need to leave the shower gel on your body as it starts working the moment it changes to luxurious foam. It gently exfoliates to unclog pores of excess oil, dirt &amp; acne-causing bacteria, leaving it feeling calm &amp; visibly acne-free over time. Suggested Rituals .ing-wrap-inner { justify-content: center !important; } @media screen and (min-width: 1440px) { .inner-data-a { text-align: center; } div[role=""progressbarz""] { margin: 3% 0 5% 0 !important; } .mascot-des { padding: 0 20% !important; } } @media screen and (max-width: 1440px) { .inner-data-a { text-align: center; } div[role=""progressbarz""] { margin: 3% 0 5% 0 !important; } .mascot-des { padding: 0 15% !important; } .skin-type-flex-item.skin-banner { width: 25% !important; } .skin-type-overlap { padding: 1% 15% !important; margin-top: -70px !important; } } @media screen and (max-width: 1024px) { .half-part { font-size: 18px !important; } .skin-type-overlap { padding: 1% 20% !important; } body .result-banner-desk>div { padding: 20px 0 !important; } div[role=""progressbarz""]::before{ font-size: 30px !important; } } @media screen and (max-width: 768px) { .clinical-heading.clinical-heading-cica-shower-gel { display: none !important; } div[role=""progressbarz""] { margin: auto !important; left: 0 !important; } .clinical-heading.clinical-heading-mob.clinical-heading-cica-shower-gel { display: block !important; } .inner-data-a { font-size: 22px !important; } .details-flex-item.img-section img { max-width: 335px !important; } .skin-type-flex-item.skin-banner { margin-left: 0 !important; width: 40% !important; } .overlap-head { padding-right: 20% !important; } .overlap-text { padding-right: 0 !important; } } @media screen and (max-width: 426px) { body .details-flex-item .detail-list li{ line-height: 20px !important; } .detail-list li { padding-bottom: 0 !important; } .img-section { margin-top: 0 !important; } .skin-type-flex-item.skin-banner { margin-left: -23% !important; width: 50% !important; } .overlap-text { max-width: 350px !important; } .ing-wrap-inner { padding: 5% 0 !important; } .inner-data-a{ font-size: 15px !important; } .skin-type-overlap{ margin-top: -30px !important; padding: 1% 10% !important; } .overlap-head{ padding-right: 0% !important; } } @media screen and (max-width: 360px) { .skin-type-overlap { margin-top: -35px !important; } }"
DK_VCGFW175,Vitamin C + E Gel Face Wash for Glowing Skin,175ml,Face Wash,"_allproducts, _Face Wash, category_Singles, cleanser, Combination Skin, Dark Spots, dark_spots, de tan, detan, enable-pmslider, exclusion_app, face scrub, face_wash, fltr_ingredients_Vitamin C, fltr_skin_concern_Dark Spots, fltr_skin_concern_Dullness, fltr_skin_concern_Pigmentation/Uneven Skin Tone, fltr_skin_type_Combination, fltr_skin_type_Dry, fltr_skin_type_Normal, fltr_skin_type_Oily, kojic, label_buy_1_get_1, Normal Skin, Oily Skin, orbo_dark_spots, orbo_pigmentation, Pigmentation, score:64, score:777, Skin Glow, skin_dullness, skinconcern_Dullness, skinconcern_Uneven Skin Tone, skintype_Dry, skintype_Oily, st_ingredients_blood_orange, st_ingredients_niacinamide, st_ingredients_vitamin_c, st_skin_type_combination, st_skin_type_dry, st_skin_type_normal, st_skin_type_oily, st_skinconcern_dullness, st_skinconcern_pigmentation",375.00,375.00,"Get clean, glowing &amp; even-toned skin with this sulphate-free Vitamin C Facewash. Infused with Triple Vitamin C, Sicilian Blood Orange, Niacinamide &amp; Vitamin E. Reduces dullness, fades dark spots &amp; de-tans for visibly even toned skin. It also unclogs pores of dirt &amp; excess oil, leaving it clean &amp; fresh A non-drying facewash that's suitable for all skin types Minimizes dullness Detans Non-Drying All Skin Types Tried. Tested. Loved. Tried. Tested. Loved. vitc-facewash 94 agreed skin appeared less tanned from 1st use *self-assessment study conducted with 36 subjects with visible tanning. Results In Clean, Even-Toned &amp; Glowing Skin Results In Clean, Even-Toned &amp; Glowing Skin Why You’ll it Deeply cleanses without over-drying Fights dullness &amp; helps de-tan Visibly boosts glow Fades dark spots &amp; pigmentation Gentle, sulphate-free formulation Targets Dullness Dark Spots Tanning Uneven Skin Tone Skin Types All Skin Types TRIPLE VITAMIN C With 3 types of Vitamin C, it reduces dullness &amp; pigmentation SICILIAN BLOOD ORANGE Antioxidant-rich superfruit, it helps de-tan skin &amp; restores natural skin tone. NIACINAMIDE A form of Vitamin B3, it fades dark spots for even-toned skin. VITAMIN E Protects skin from external aggressors &amp; improves overall skin texture. Aqua, Cocamidopropyl Betaine, Decyl Glucoside, Glycerine, Disodium Cocoyl Glutamate, Triethanolamine, Acrylates/C10-30 Alkyl Acrylate Crosspolymer, Xanthan Gum, PEG-40 Hydrogenated Castor Oil, Niacinamide, Citric Acid, Disodium EDTA, Menthol, Sodium Ascorbyl Phosphate, Mentha Piperita (Peppermint) Oil, Panthenol, Glycerin (and) Water (and) Terminalia Ferdinandiana Fruit Extract, Citrus Sinensis (Blood Orange) Fruit Extract, Tocopheryl Acetate, Benzyl Alcohol (and) Ethylhexylglycerin (and) Tocopherol, Fragrance, CI 15985, CI 19140. Take a small amount Apply to wet face Massage gently for 20 seconds Rinse &amp; pat dry Follow with serum, moisturizer &amp; sunscreen Note: Use twice daily (AM &amp; PM) for best results Suggested Routine for glowing Skin More From Face Cleansers Products Ideal Skin Type What it Does Sulphate Free Fragrance Free Vitamin C Face Wash All Skin Types Boosts Skin Glow Barrier Repair Face Wash Normal, Dry &amp; Sensitive Hydrates While Cleansing Cica Face Wash Oily &amp; Acne-Prone Reduces Acne &amp; Calms Redness Watermelon Face Wash Normal, Oily &amp; Combination Skin Controls Excess Oil Clean Formulations Cleaner Ingredients SULPHATE FREE SOAP FREE MINERAL OIL FREE PARABEN FREE GMO FREE CRUELTY FREE Q. What are the 3 types of vitamin C present in the Triple Vitamin C ingredient? A-Our facewash consists of Triple Vitamin C which is made of Kakadu Plump, Ethyl Ascorbic Acid &amp; Sicilian Blood Orange. Q. I have dry skin which has got tanned due to excessive sun exposure. Will this facewash suit me? A-Yes. Our Vitamin C Gel Facewash is suitable for all skin types. It's sulphate-free &amp; non-drying which makes it a good match for dry skin as well. It will also help with de-tanning your skin. For best results, you can try our SPF 50 Vitamin C Sunscreen to further minimize tanning &amp; sunburn. Q. Will this also help remove dirt, SPF &amp; makeup? A-Yes. It'll effectively remove dirt, SPF &amp; even makeup, without over-drying your skin. Q. Suggest a complete vitamin C routine with this facewash. A- Vitamin C Gel Facewash-&gt; 10% Vitamin C Serum-&gt; Vitamin C Moisturizer-&gt;SPF 30 Vitamin C Eye Cream-&gt; SPF 50 Vitamin C Sunscreen (AM) Q. Is this facewash suitable for pregnant &amp; lactating women? A- Yes. It is suitable for pregnant &amp; lactating women. Suggested Rituals #redirect_product { cursor: pointer; }"
DK_VCGFW,Vitamin C + E Gel Face Wash for Glowing Skin,100ml,Face Wash,"_allproducts, _Face Wash, category_Singles, cleanser, Combination Skin, Dark Spots, dark_spots, de tan, detan, enable-pmslider, exclusion_app, face scrub, face_wash, fltr_ingredients_Vitamin C, fltr_skin_concern_Dark Spots, fltr_skin_concern_Dullness, fltr_skin_concern_Pigmentation/Uneven Skin Tone, fltr_skin_type_Combination, fltr_skin_type_Dry, fltr_skin_type_Normal, fltr_skin_type_Oily, kojic, label_buy_1_get_1, Normal Skin, Oily Skin, orbo_dark_spots, orbo_pigmentation, Pigmentation, score:64, score:777, Skin Glow, skin_dullness, skinconcern_Dullness, skinconcern_Uneven Skin Tone, skintype_Dry, skintype_Oily, st_ingredients_blood_orange, st_ingredients_niacinamide, st_ingredients_vitamin_c, st_skin_type_combination, st_skin_type_dry, st_skin_type_normal, st_skin_type_oily, st_skinconcern_dullness, st_skinconcern_pigmentation",249.00,249.00,"Get clean, glowing &amp; even-toned skin with this sulphate-free Vitamin C Facewash. Infused with Triple Vitamin C, Sicilian Blood Orange, Niacinamide &amp; Vitamin E. Reduces dullness, fades dark spots &amp; de-tans for visibly even toned skin. It also unclogs pores of dirt &amp; excess oil, leaving it clean &amp; fresh A non-drying facewash that's suitable for all skin types Minimizes dullness Detans Non-Drying All Skin Types Tried. Tested. Loved. Tried. Tested. Loved. vitc-facewash 94 agreed skin appeared less tanned from 1st use *self-assessment study conducted with 36 subjects with visible tanning. Results In Clean, Even-Toned &amp; Glowing Skin Results In Clean, Even-Toned &amp; Glowing Skin Why You’ll it Deeply cleanses without over-drying Fights dullness &amp; helps de-tan Visibly boosts glow Fades dark spots &amp; pigmentation Gentle, sulphate-free formulation Targets Dullness Dark Spots Tanning Uneven Skin Tone Skin Types All Skin Types TRIPLE VITAMIN C With 3 types of Vitamin C, it reduces dullness &amp; pigmentation SICILIAN BLOOD ORANGE Antioxidant-rich superfruit, it helps de-tan skin &amp; restores natural skin tone. NIACINAMIDE A form of Vitamin B3, it fades dark spots for even-toned skin. VITAMIN E Protects skin from external aggressors &amp; improves overall skin texture. Aqua, Cocamidopropyl Betaine, Decyl Glucoside, Glycerine, Disodium Cocoyl Glutamate, Triethanolamine, Acrylates/C10-30 Alkyl Acrylate Crosspolymer, Xanthan Gum, PEG-40 Hydrogenated Castor Oil, Niacinamide, Citric Acid, Disodium EDTA, Menthol, Sodium Ascorbyl Phosphate, Mentha Piperita (Peppermint) Oil, Panthenol, Glycerin (and) Water (and) Terminalia Ferdinandiana Fruit Extract, Citrus Sinensis (Blood Orange) Fruit Extract, Tocopheryl Acetate, Benzyl Alcohol (and) Ethylhexylglycerin (and) Tocopherol, Fragrance, CI 15985, CI 19140. Take a small amount Apply to wet face Massage gently for 20 seconds Rinse &amp; pat dry Follow with serum, moisturizer &amp; sunscreen Note: Use twice daily (AM &amp; PM) for best results Suggested Routine for glowing Skin More From Face Cleansers Products Ideal Skin Type What it Does Sulphate Free Fragrance Free Vitamin C Face Wash All Skin Types Boosts Skin Glow Barrier Repair Face Wash Normal, Dry &amp; Sensitive Hydrates While Cleansing Cica Face Wash Oily &amp; Acne-Prone Reduces Acne &amp; Calms Redness Watermelon Face Wash Normal, Oily &amp; Combination Skin Controls Excess Oil Clean Formulations Cleaner Ingredients SULPHATE FREE SOAP FREE MINERAL OIL FREE PARABEN FREE GMO FREE CRUELTY FREE Q. What are the 3 types of vitamin C present in the Triple Vitamin C ingredient? A-Our facewash consists of Triple Vitamin C which is made of Kakadu Plump, Ethyl Ascorbic Acid &amp; Sicilian Blood Orange. Q. I have dry skin which has got tanned due to excessive sun exposure. Will this facewash suit me? A-Yes. Our Vitamin C Gel Facewash is suitable for all skin types. It's sulphate-free &amp; non-drying which makes it a good match for dry skin as well. It will also help with de-tanning your skin. For best results, you can try our SPF 50 Vitamin C Sunscreen to further minimize tanning &amp; sunburn. Q. Will this also help remove dirt, SPF &amp; makeup? A-Yes. It'll effectively remove dirt, SPF &amp; even makeup, without over-drying your skin. Q. Suggest a complete vitamin C routine with this facewash. A- Vitamin C Gel Facewash-&gt; 10% Vitamin C Serum-&gt; Vitamin C Moisturizer-&gt;SPF 30 Vitamin C Eye Cream-&gt; SPF 50 Vitamin C Sunscreen (AM) Q. Is this facewash suitable for pregnant &amp; lactating women? A- Yes. It is suitable for pregnant &amp; lactating women. Suggested Rituals #redirect_product { cursor: pointer; }"
DK_CVCMSU,Glow+ Protect Vitamin C Duo,60ml+50g,Combo,"_allproducts, _combo-product, _combo-timer, Dry Skin, kojic, label_25_off_combo25, label_buy_1_get_1, Moisturizer, not-searchable, Pigmentation, st_ingredients_vitamin_c, st_skin_type_oily, Sunscreen",940.00,940.00,
DK_CVCMSE,Vitamin C Daily Essential Combo,90ml,Combo,"_allproducts, _combo-product, Dry Skin, label_25_off_combo25, label_buy_1_get_1, Moisturizer, Serums And Oils, st_skin_type_oily",1190.00,1190.00,
DK_WCEP,Watermelon Hydrogel Under-eye Patches,30 Pairs,Eye Care,"_allproducts, Combination Skin, Dry Skin, exclude-ip-product, Eye-care, eyecare, hyluronic, label_15_off_flat15, label_buy_1_get_1, limit__1, Normal Skin, orbo_dark_circle, orbo_smoothness, orbo_texture, score:55, Sensitive Skin, smoothness, st_ingredients_hyaluronic, st_ingredients_niacinamide, st_ingredients_watermelon, st_redirect, st_skin_type_combination, st_skin_type_dry, st_skin_type_normal, st_skin_type_oily, st_skin_type_sensitive, texture, under eye, watermelon",799.00,799.00,"Instant cooling under-eye patches for visibly fresh, hydrated &amp; luminous under-eyes in 15 minutes. Punched with juicy watermelon, it instantly cools &amp; refreshes. With hyaluronic acid &amp; niacinamide , it hydrates under-eye skin while reducing dark circles over time. Supercharged with caffeine to depuff &amp; firm delicate under- eye area. No-slip, easy-to-apply patches drenched in quick-absorbing, lightweight serum that causes zero irritation. Cools De-puffs Hydrates All Skin Types Tried. Tested. Loved. Tried. Tested. Loved. blue 98 agreed that skin felt instantly cool &amp; refreshed* 97 observed less puffiness after 1st use* *self-assessment study conducted with 36 subjects with tired, puffy under-eye skin. Results In Fresh, Hydrated &amp; Luminous Under-Eyes Results In Plump, Healthy &amp; Hydrated Skin why you’ll it Cools &amp; de-puffs in 15 minutes Deeply hydrates &amp; refreshes Reduces dark circles Does not irritate under-eyes No slip &amp; easy-to-apply Targets Puffiness Dryness Dark Circles Signs of Fatigue Great For All Skin Types Watermelon Antioxidant-rich, it instantly cools &amp; refreshes under-eyes skin with added luminosity Hyaluronic Acid Intensely hydrates by binding water molecules skin deep to prevent dryness. Caffeine Reduces under-eye puffiness &amp; firms skin by improving blood circulation Niacinamide Minimizes dark circles &amp; evens skin tone DM Water, Glycerin, Carrageenan, Niacinamide, Benzyl Alcohol, Ethylhexylglycerin, Tocopherol, Glycerin, Glyceryl Glucoside, Guar Gum, Watermelon Extract, Aloe Barbadensis Miller (Aloe Vera) Extract, Caffeine, Allantoin, Aminomethyl Propanol, Xanthan Gum, Hydrolyzed Soybean Fiber, Chenopodium Quinoa Seed Extract, Propanediol, Glycolic Acid, Polyacrylate Crosspolymer-6, DMDM Hydantoin, Methylchloroisothiazolinone, Methylisothiazolinone, Disodium EDTA, Sodium Hyaluronate, Synthetic Fluorphlogopite, Titanium Dioxide, Tin Oxide, CI 12490 Separate the patches with the spatula Place one patch under each eye Leave it on for 15 minutes Gently remove &amp; pat in the excess serum Use thrice a week for best results Clean Formulations Cleaner Ingredients MINERAL OIL FREE PARABEN FREE ESSENTIAL OIL FREE SULPHATE FREE GMO FREE CRUELTY FREE Can I use these eye patches every day? Yes. You can use the eye patches every day to cool, de-puff &amp; hydrate your under-eye skin in just 15 minutes. Can I reuse the under-eye patches? No, these patches are made for single use only to deliver the best results. Is this pregnancy &amp; lactation safe? Yes. Our Watermelon Cooling Eye Patches are pregnancy &amp; lactation safe. Should I wash my face after removing the eye patch? No. Our eye patches are drenched in serum that's infused with Hyaluronic Acid &amp; Niacinamide. Hence, it is recommended not to wash your face to continue enjoying the skin benefits of the serum. Will it make my under-eye skin feel sticky? No. The eye patches are saturated in lightweight, quick-absorbing serum that easily sinks into your skin without making it feel greasy or sticky. Can I use Dot &amp; Key Retinol Eye Cream after using the eye patches? Yes. You can use our Retinol Eye Cream for a more visible result over time. Suggested Rituals /* td { border: 1px solid #ccc; } br { mso-data-placement: same-cell; } */ .list-benefit { font-weight: 700 !important; flex-wrap: wrap !important; } .revised-price { justify-content: center !important; } .product__policies.rte { text-align: center !important; } #redirect_product { cursor: pointer; } @media (max-width: 480px) { .list-benefit { flex-wrap: wrap !important; } body .detail-head { font-size: 22px !important; } body .detail-list li { font-size: 18px !important; } } @media (max-width: 360px) { body .most-loved-table td { height: 70px !important; } }"
DK_PREC,Pomegranate + Retinol Eye Cream for Dark Circles,20ml,Eye Care,"_allproducts, Age Defense, Combination Skin, crows_feet, dark_circle, Dry Skin, Eye-care, eye_wrinkles, eyecare, fltr_ingredients_Retinol, fltr_skin_concern_Ageing, fltr_skin_type_Combination, fltr_skin_type_Normal, fltr_skin_type_Oily, just-in, label_15_off_flat15, label_buy_1_get_1, Normal Skin, orbo_crows_feet, orbo_dark_circle, orbo_eye_wrinkles, orbo_firmness, orbo_smoothness, Sensitive Skin, st_ingredients_pomegranate, st_ingredients_retinol, st_skin_type_combination, st_skin_type_normal, st_skin_type_oily, st_skin_type_sensitive, st_skinconcern_ageing, under eye",495.00,495.00,"Collagen-boosting under-eye cream that depuffs, smoothens &amp; firms delicate under-eye areas. Powered by retinol, pomegranate &amp; collagen peptide . Visibly reduces fine lines &amp; wrinkles for smoother, firmer skin. Effectively fade dark circles &amp; de-puffs for fresh, radiant under-eyes. Deeply moisturizes while soothing &amp; relaxing with built-in zinc metal applicator. Boosts Collagen Firms &amp; Depuffs Moisturizes Normal, Oily, Combination Skin Tried. Tested. Loved. Tried. Tested. Loved. blue 93 of users saw firmer under eye skin in 4 weeks* 94 observed visible reduction in puffiness in 4 weeks* *self-assessment study conducted with 36 subjects over 4 weeks Results In Firm, Radiant &amp; Youthful Under-Eye Skin Results In Firm, Radiant &amp; Youthful Under-Eye Skin why you’ll it Treats fine lines &amp; wrinkles Metal applicator reduces puffiness Restores essential moisture Fades dark circles Fragrance &amp; dyes free Targets Fine Lines Wrinkles Loss of Firmness Puffiness Dark Circles Great For All Skin Types Retinol Boosts collagen &amp; smoothes lines &amp; wrinkles for firmer under-eye Caffeine Prevents water retention, boosts blood circulation &amp; de-puffs under eye area Pomegranate Antioxidant-rich, it fades dark circles for visibly fresh &amp; radiant under-eye skin Rosehip Oil Deeply moisturizes to prevent dryness while improving skin elasticity Aqua, Caprylic/Capric Triglyceride, 1,3-Butylene Glycol, Dicaprylyl Ether, Siloxanetriol Alginate (and) Caffeine (and) Butylene Glycol, Glyceryl Stearate (and) PEG-100 Stearate, Cetearyl Alcohol, Cetearyl Olivate (and) Sorbitan Olivate, Lauryl Laurate, Glycerine, C14-22 Alcohols (and) C12-20 Alkyl Glucoside, Stearyl Dimethicone (and) Octadecene, Acrylates/C10-30 Alkyl Acrylate Crosspolymer, Allantoin, Disodium EDTA, Tocopheryl Acetate, Sodium Hydroxide, Sodium Hyaluronate, Retinol, Rosa Rubiginosa (Rosehip) Seed Oil, Scutellaria Baicalensis Root Extract (and) Paeonia Suffruticosa Root Extract (and) Saxifraga Sarmentosa Extract [and] Acetyl Tyrosine [and] Arbutin (and) Glutathione (and) Aminopropyl Ascorbyl Phosphate, Simmondsia Chinensis (Jojoba) Seed Oil, Methylsilanol Mannuronate, Olea Europaea (Olive) Fruit Oil, Punica Granatum (Pomegranate) Seed Oil, Argania Spinosa (Argan) Kernel Oil, Coffea Arabica (Coffee) Seed Extract, Benzyl Alcohol (and) Ethylhexylglycerin (and) Tocopherol, Butylated Hydroxytoluene. Apply eye cream around the eye contour Massage gently with the built-in metal applicator Dab the excess with your fingertips Use daily in PM for best results Clean Formulations Cleaner Ingredients MINERAL OIL FREE Paraben FREE ESSENTIAL OIL FREE Sulphate Free Synthetic Dyes FREE Cruelty Free Q. How does the moisturizer work for the skin? A. Our Barrier Repair Face cream with 5 essential ceramides helps repair &amp; rebuild skin's barrier. It also protects skin from external aggressors while locking in moisture, leaving it healthy, soft &amp; plump. Q. My skin is extremely dry &amp; sensitive. Will it suit my skin type? A. Yes. This moisturizer is made to suit very dry &amp; sensitive skin. Q. Will it heal visible dry patches, itching &amp; irritation? A. This moisturizer is infused with hyaluronic acid, probiotics &amp; rice water, all of which come together to hydrate skin deeply, soothe irritation &amp; itchiness to provide a healthy skin texture. Q. Can I use this face cream with my vitamin C serum? A. Yes, you can! It can be incorporated with any other ingredient as it works well with all skincare actives. Q. How often should I use this moisturizer for best results? A. For best results, add it to your daily AM &amp; PM routine. Suggested Rituals /* td { border: 1px solid #ccc; } br { mso-data-placement: same-cell; } */ body .skin-type-flex { margin: 0px 0px 0px auto !important; } #redirect_product { cursor: pointer; } @media(max-width: 768px) { .inner-data-b #clinical-highlight { margin: auto !important; } body .most-loved-table td { height: 90px !important; } body .detail-head { font-size: 30px !important; } body .detail-list li { font-size: 18px !important; } body .skin-type-flex-list li { font-size: 18px !important; } body .most-loved-table th:first-child { min-height: 180px !important; } body .most-loved-table th { min-height: 90px !important; } } @media(max-width: 426px) { body .most-loved-table th:first-child { min-height: 90px !important; } body .detail-head { font-size: 24px !important; } } @media(max-width: 376px) { body .detail-head { font-size: 24px !important; } body .most-loved-table th:first-child { min-height: 90px !important; } } @media(max-width: 360px) { body .detail-head { font-size: 20px !important; } }"
