SKU,Title,Variant,Type,Tags (Features/Applications),Price,Compare At Price,Description (Use/Features)
DK_VCES_VCGFW1,Good to Glow Vitamin C Combo,150ml,Combo,"_allproducts, _combo-product, _Face Wash, Combination Skin, combo, ex-app, kojic, label_25_off_combo25, label_buy_1_get_1, Oily Skin, Pigmentation, skinconcern_Clogged Pores, skintype_all, skintype_Combination, st_ingredients_vitamin_c, st_skin_type_combination, st_skin_type_oily, Sunscreen, winter must haves",694.00,694.00,"Vitamin C Face Wash: Non-drying &amp; sulphate-free, it deeply cleanses, reduces dullness &amp; tan with triple vitamin C, niacinamide &amp; Sicilian Blood Orange. Vitamin C Sunscreen: SPF 50+, PA++++, this water-light sunscreen provides high UV protection &amp; boosts glow while reducing dullness &amp; dark spots. Triple Vitamin C Water-Light Sulphate-Free All Skin Types What Makes it a Power Combo Deeply cleanses without over drying Reduces dullness &amp; tan Minimizes dark spots &amp; pigmentation Protects against sun damage Visibly boosts skin glow Targets Dullness Pigmentation Dark Spots Tanning &amp; Sun Damage Skin Types All Skin Types Triple Vitamin C Reduces dullness &amp; uneven skin tone while boosting skin glow Sicilian Blood Orange Boosts collagen, firms &amp; re-energises skin while reducing tan Niacinamide Helps reduce dark spots &amp; pigmentation for visibly clearer skin Vitamin E Boosts vitamin C efficacy &amp; improves overall skin texture Vitamin C Sunscreen: Water, Ethyl Ascorbic Acid, Niacinamide, Glycerine, Ethoxydiglycol, Propanediol, 1,3-Butylene Glycol, Ethylhexylglycerin (and) Phenoxyethanol, Tocopheryl Acetate, Ferulic Acid, Citric Acid, Xanthan gum, Hydroxyethyl Cellulose, Disodium EDTA, Sodium Gluconate, Allantoin, Sodium Hyaluronate, Alpha Arbutin, Laminaria Digitata Extract (and) Cetyl-PG Hydroxyethyl Palmitamide (and) Ceramide mix, Citrus Aurantium Dulcis (Blood Orange) Fruit Extract, Terminalia Ferdinandiana (Kakadu Plum) Fruit Extract, Cucurbita Pepo (Pumpkin) Fruit Extract Vitamin C Gel Face Wash: Aqua, Cocamidopropyl Betaine, Decyl Glucoside, Glycerine, Disodium Cocoyl Glutamate, Triethanolamine, Terminalia Ferdinandiana (Kakadu Plum) Fruit Extract, Citrus Aurantium Dulcis (Blood Orange) Fruit Extract, Niacinamide, Benzyl Alcohol (and) Ethylhexylglycerin (and) Tocopherol, Acrylates/C10-30 Alkyl Acrylate Crosspolymer, Xanthan Gum, PEG-40 Hydrogenated Castor Oil, Disodium EDTA, Citric Acid, Menthol, Sodium Ascorbyl Phosphate, Mentha Piperita (Peppermint) Oil, D-Panthenol, Tocopheryl Acetate, IFRA Certified Allergen Free Fragrance, CI 15985, CI 19140 How To Use? Vitamin C Face Wash: Gently massage, lather &amp; rinse. Pat Dry. Vitamin C Sunscreen: Apply liberally on the face &amp; neck 15 mins before sun exposure. Re-apply every 2 hours. How To Use? Vitamin C Face Wash: Gently massage, lather &amp; rinse. Pat Dry. Vitamin C Sunscreen: Apply liberally on the face &amp; neck 15 mins before sun exposure. Re-apply every 2 hours. Q. Suggest a complete routine with this combo. A. Vitamin C Face Wash-&gt; 10% Vitamin C Serum-&gt; Vitamin C Moisturizer-&gt; Vitamin C Sunscreen SPF 50+, PA++++. Q. I have sensitive skin. Is this combo suitable for my skin? A. We recommend you try any of our Cica Skincare Combo or Barrier Repair Combo. If you have acne-prone, sensitive skin, you can try our Cica Combos. If you have dry, sensitive skin, you can opt for our Barrier Repair Combo. Q. Will the sunscreen cause pilling or burn my eyes? A. No. All our sunscreens are extremely lightweight &amp; quick-absorbing, which causes zero pilling. Plus, the formula is free of irritants &amp; allergens making them gentle enough, even for your delicate eye area. Q. Will the sunscreen feel heavy on my skin? A. No. No. Our Vitamin C Sunscreen features a unique water-light texture that's extremely lightweight &amp; quick-absorbing. It blends seamlessly into your skin, giving a beautiful dewy finish without any heavy, sticky or greasy after-feel. Q. Suggest any other active that I can pair with this Vitamin C combo? A. No.Ceramide &amp; hyaluronic acid works beautifully with vitamin C. You can try our Barrier Repair products with this combo for glowing, healthy skin. Suggested Rituals"
DK_CMFW,High On Hydration Combo,160ml,Combo,"_allproducts, _combo-product, _Face Wash, Combination Skin, combo, Dry Skin, ex-app, facewash and moisturizer, Hydration, label_25_off_combo25, label_buy_1_get_1, Moisturizer, Normal Skin, Oily Skin, skinconcern_Dehydrated, skinconcern_Dryness, skintype_all, skintype_Combination, skintype_Dry, skintype_Oily, skintype_Sensitive, st_skin_type_combination, st_skin_type_dry, st_skin_type_normal, winter must haves, winter-pick",744.00,744.00,
DK_HGPR,72HR Hydrating Gel Moisturizer + Probiotics,60ml,Moisturiser,"_allproducts, _Best Sellers, _daily, activeAcne, BBB TOP PICK, category_Singles, Combination Skin, Dry Skin, dryAcne, Dryness And Repair, exclusion_app, flat20, fltr_dnk_best_selling_Best-Selling, fltr_ingredients_Hyaluronic + Ceramides, fltr_ingredients_Others, fltr_skin_concern_Dryness, fltr_skin_type_Combination, fltr_skin_type_Dry, fltr_skin_type_Normal, fltr_skin_type_Oily, Hydration, hyluronic, label_15_off_flat15, label_buy_1_get_1, moisture, Moisturizer, moisturizer_combination, moisturizer_damage, moisturizer_day, moisturizer_night, moisturizer_normal, moisturizer_notsure, moisturizer_oily, mosturiser, mosturizer, Normal Skin, orbo_hydration, orbo_redness, orbo_shine, postAcne, probiotics, redness, score:58, shine, skinconcern_Dehydrated, skintype_Combination, skintype_Oily, st_ingredients_blueberry, st_ingredients_ceramides, st_ingredients_hyaluronic, st_skin_type_combination, st_skin_type_dry, st_skin_type_normal, st_skin_type_oily, st_skinconcern_damaged_skin_barrier, st_skinconcern_dryness, st_skinconcern_excess_oil, Summer Picks, Uneven Tone, uneven_skin",495.00,495.00,"Enjoy 72HR non-stop hydration for plump, healthy skin. Infused with Hyaluronic Acid, Probiotics &amp; Japanese Rice Water. Binds water molecules skin deep for lightweight yet intense hydration. Boosts skin microbiome &amp; repairs skin barrier for healthy skin. Non-comedogenic &amp; oil-free, it’s ideal for oily &amp; combination skin. Oil-Free Lightweight Non-Comedogenic Oily &amp; Combination Skin Clinically Proven Clinically Proven blue 96 agreed that skin felt hydrated even after 72 hours* 100 agreed that the skin felt plumper within a week* *Based on a clinical study conducted by Mascot Spincontrol on 100 subjects. Results In Plump, Healthy &amp; Hydrated Skin Results In Plump, Healthy &amp; Hydrated Skin why you’ll it 72HR non-stop hydration Repairs skin barrier Balances skin microbiome Oil-free formula Non-comedogenic Targets Dehydration Weakened Skin Barrier Loss of Skin Elasticity Great For: Oily &amp; Combination Skin Not Suitable For: Dry Skin Hyaluronic Acid Moisture magnet that locks in water molecules skin deep to boost hydration. Probiotics Balances skin's microbiome level to improve overall skin health. Japanese Rice Water Natural soothing agent that calms redness, irritation &amp; inflammation. 5 Ceramides Strengthens skin barrier &amp; locks in moisture for healthy skin texture. Aqua, Cyclopentasiloxane, Cyclopentasiloxane (and) Dimethicone Crosspolymer, Glycerine, Xylitylglucoside (and) Anhydroxylitol (and) Xylitol, Divinyldimethicone/Dimethicone Copolymer (and) C12-13 Pareth-23 (and) C12-13 Pareth-3, Polyacrylamide (and) C13-14 Isoparaffin (and) Laureth-7, Sodium Polyacryloyldimethyl Taurate, Hydrogenated Polydecene, Trideceth-10, Dimethylsilanol Hyaluronate, Silanetriol (and) Hyaluronic Acid, Caprylyl Methicone (and) PEG-12 Dimethicone/PPG-20 Crosspolymer, Methylsilanol Mannuronate, Acrylates/C10-30 Alkyl Acrylate Crosspolymer, Saccharide Isomerate (and) Citric Acid (and) Sodium Citrate, Laminaria Digitata Extract (and) Hydrogenated Lecithin (and) Cetyl-PG Hydroxyethyl Palmitamide (and) Ceramide 1, 2,3,4,6II (and) Cholesterol (and) 1,2-hexanediol, Disodium EDTA, Aqua (and) Glycerin (and) Trehalose (and) Urea (and) Serine (and) Pentylene Glycol (and) Glyceryl Polyacrylate (and) Algin (and) Caprylyl Glycol (and) Sodium Hyaluronate (and) Pullulan (and) Disodium Phosphate (and) Potassium Phosphate, Sodium Hydroxide, Lactococcus Ferment Lysate, Saccharomyces/Xylinum/Black Tea Ferment, Avena Sativa Kernel (Oat) Extract, Aqua (and) Oryza Sativa (Rice) Extract (and) Saccharomyces ferment lysate filtrate (and) Citric acid (and) Sodium Benzoate (and) Potassium sorbate, Glycerin (and) Aqua (and) Vaccinium Angustifolium (Blueberry) Fruit Extract, Phenoxyethanol (and) Ethylhexylglycerin, Fragrance, CI 42090 . Dot the gel on clean face &amp; neck Massage gently in an upward motion Use daily for AM &amp; PM routine Follow up with sunscreen during daytime Suggested Routine for Hydrated Skin More From Lightweight Moisturizers Products Ideal Skin Type Texture What it does 72HR Gel Moisturizer Oily &amp; Combination Oil-Free, Water Gel 72HR non-stop hydration Vitamin C+E Moisturizer Normal, Oily &amp; Combination Sorbet Gel Boosts Skin Glow Barrier Repair Face Cream Normal, Dry, Sensitive &amp; Combination Smooth Repairs skin barrier Cica Moisturizer Oily &amp; Acne-Prone Skin Ultra-Light, Water Gel Reduces acne &amp; acne scars Clean Formulations Cleaner Ingredients MINERAL OIL FREE PARABEN FREE ESSENTIAL OIL FREE SULPHATE FREE GMO FREE CRUELTY FREE What is hydrating gel for? 72 HR Probiotic Gel Moisturizer with Hyaluronic and Rice Water delivers a feeling of elasticity, firmness, and suppleness without clogging pores. As part of your everyday skin care routine, apply this hydrating gel for dry skin once or twice daily after cleaning and toning. Is Dot and key hydrating gel a moisturizer? Yes, this is a light, gel-creme moisturiser created with hyaluronic acid, prebiotics, and probiotics, all of which work together to improve the skin's natural ecology of good bacteria, resulting in a more youthful appearance. Are probiotics good in skincare? Probiotic moisturisers are good for all skin types, but they're especially good for people who have chronic inflammation. [Probiotics] can help people with acne and skin problems like rosacea and eczema have calmer skin and better control over breakouts. Suggested Rituals /* td { border: 1px solid #ccc; } br { mso-data-placement: same-cell; } */ .list-benefit { font-weight: 700 !important; flex-wrap: wrap !important; } .revised-price { justify-content: center !important; } .product__policies.rte { text-align: center !important; } #redirect_product { cursor: pointer; } @media (max-width: 480px) { .list-benefit { flex-wrap: wrap !important; } body .detail-head { font-size: 22px !important; } body .detail-list li { font-size: 18px !important; } } @media (max-width: 360px) { body .most-loved-table td { height: 70px !important; } }"
DK_LRSSS,"Swim + Sports Sunscreen, In-Vivo Tested SPF 50+ PA++++",50g,Sunscreen,"_allproducts, Combination Skin, fltr_ingredients_Others, fltr_skin_concern_Others, fltr_skin_type_Combination, fltr_skin_type_Normal, fltr_skin_type_Oily, just-in, label_15_off_flat15, label_buy_1_get_1, Normal Skin, score:999, Sensitive Skin, st_ingredients_lime, st_skin_type_combination, st_skin_type_normal, st_skin_type_oily, st_skin_type_sensitive, sun screen, suncream, suncreen, Sunscreen",495.00,495.00,"180 mins water + sweat resistant sunscreen for your active lifestyle Infused with lime &amp; multi-vitamins to restore healthy skin Provides broad spectrum protection with potent UV filters Checks tanning &amp; further sun damage, even after prolonged exposure to sun &amp; pool water Avobenzone &amp; oxybenzone free, this lightweight sunscreen is great for all skin types Prevents Tanning Lightweight No White Cast All Skin Types lime-sports-sunscreen Tried. Tested. Loved. 96 saw less tanning, even after sun exposure for hours.* 98 agreed that it's lightweight &amp; quick - absorbing.* *Self-assessment study conducted with 36 subjects highly involved in outdoor sports activity. High-Performance Sunscreen for UVA, UVB &amp; Blue Light Protection High-Performance Sunscreen for UVA, UVB &amp; Blue Light Protection Why You'll It 180 mins water+sweat resistant Prevents tanning &amp; sunburn Active sports-friendly formula Avobenzone &amp; oxybenzone free Non-sticky, light lotion Great For All Skin Types Lime Checks free radical damage to restore healthy skin UV Filters Broad spectrum protection with UV filters like Tinosorb M, Uvinul A Plus &amp; Octinoxate Multi-Vitamins Improves the effectiveness of UV filters to deliver better sun protection Water, Ethylhexyl Methoxycinnamate, Dibutyl Adipate, Dicaprylyl Carbonate, Diethylamino Hydroxybenzoyl Hexyl Benzoate, Polyglyceryl-2 Dipolyhydroxystearate, Methylene Bis-Benzotriazolyl Tetramethylbutylphenol (and) Aqua (and) Decyl Glucoside (and) Propylene Glycol (and) Xanthan Gum, Dimethicone, Glycerine, Sodium Lauryl Glucose Carboxylate (and) Lauryl Glucoside, Citrus Aurantifolia (Lime) Fruit Extract, Niacinamide, Tocopheryl Acetate, Panthenol, Xanthan Gum, Sodium Polyacrylate, Phenoxyethanol (and) Ethylhexylglycerin. Apply on face, neck &amp; other exposed areas. Use 15 minutes before sun &amp; water exposure. Re-apply every 2 hrs in case of prolonged sun &amp; water exposure. Suitable for daily use. most loved Sunscreens Products Skin Type texture FINISH benefit water resistant FRAGRANCE Swim+Sports Sunscreen All Skin Types Light, Breathable Lotion Natural Prevents tanning with high UV protection 180 mins Watermelon Sunscreen Oily &amp; Combination Aqua gel Non-Oily Instantly Cools Skin 80 mins Vitamin C+E Sunscreen All Skin Types Water-Light Fluid Dewy Boosts Glow 80 mins Blueberry Sunscreen All Skin Types Water Cream Natural Repairs Skin Barrier 80 mins Our Sunscreen Promise No White Cast No Pilling Non Comedogenic Does Not Sting Eyes Fragrance Free Light weight Q. How will the sunscreen minimize tanning caused by pool water &amp; sun exposure? A. Our swim sunscreen is formulated to create a thin, breathable barrier on your skin that will help reflect the harmful UV rays that will not only minimize tanning but also prevent skin damage. Q. How is this sunscreen different from other Dot &amp; Key sunscreens? A. Swim+Sports Sunscreen has been curated to provide high UV protection, i.e. it protects your skin from UVA+UVB rays for longer hours while keeping your skin water &amp; sweat resistant for 180 minutes. Q. What is the texture of the sunscreen like? A. The sunscreen features a lightweight &amp; quick-absorbing lotion-like texture that provides zero sticky &amp; greasy after feel. Q. Is this safe for pregnant &amp; lactating women? A. No. Our sunscreen is not safe for pregnant &amp; lactating women. Q. Will the sunscreen leave behind a white cast? A. No. The sunscreen provides a natural finish with zero white cast. Suggested Rituals #redirect_product { cursor: pointer; } @media(max-width: 426px) { body .detail-head { padding: 0px 0px 10px 20px !important; font-size: 22px !important; } body .detail-list li { font-size: 18px !important; } }"
DK_NVBHBRS,"Barrier Repair Sunscreen, In-Vivo Tested SPF 50+ PA++++",80g,Sunscreen,"_allproducts, category_Singles, Combination Skin, Dry Skin, Dryness And Repair, enable-pmslider, exclusion_app, fltr_dnk_best_selling_Best-Selling, fltr_ingredients_Hyaluronic + Ceramides, fltr_ingredients_Others, fltr_skin_concern_Dryness, fltr_skin_concern_Others, fltr_skin_type_Combination, fltr_skin_type_Dry, fltr_skin_type_Normal, fltr_skin_type_Oily, fltr_skin_type_Sensitive, Hydration, hyluronic, label_15_off_flat15, label_buy_1_get_1, Normal Skin, Offer popup, orbo_hydration, orbo_redness, redness, score:9999999, Sensitive Skin, skinconcern_Dehydrated, skinconcern_Dryness, skintype_Dry, st_ingredients_blueberry, st_ingredients_ceramides, st_ingredients_hyaluronic, st_skin_type_combination, st_skin_type_dry, st_skin_type_normal, st_skin_type_sensitive, st_skinconcern_damaged_skin_barrier, st_skinconcern_dryness, sun screen, suncream, suncreen, sunprotection, Sunscreen, sunscreen_combination, sunscreen_damaged, Sunscreen_dewy, sunscreen_dry, sunscreen_matte, Sunscreen_natural, sunscreen_normal, sunscreen_notsure, sunscreen_oilfree, Sunscreen_oily, sunscreen_sensitive",595.00,595.00,"SPF 50+, PA++++ hydrating sunscreen for healthy, sun-protected skin. Made with 5 ceramides along with hyaluronic &amp; blueberry. With 6 UV Filters, it delivers high UV &amp; blue light protection Repairs &amp; boosts skin barrier with long-lasting hydration. Light water cream &amp; quick absorbing , it's ideal for all skin types. 6 UV Filters Water Cream Lightweight For All Skin Types barrier-repair-sunscreen Tried. Tested. Loved. 96 saw less tanning from the first use.* 99 agreed that skin felt hydrated immediately.* *Self-assessment study conducted with 36 subjects with dry, sensitive skin. Results In Healthy, Hydrated &amp; Sun Protected Skin Results In Healthy, Hydrated &amp; Sun Protected Skin Why You'll It Boosts skin barrier 80 mins water resistant 6 UV filters- Broad Spectrum Protection Absorbs in seconds Long-lasting hydration Great For ALL SKIN TYPES 5 Ceramides Strengthens skin's barrier &amp; locks-in moisture for healthy skin. 6 UV Filters Provides broad spectrum protection with extremely high UVA, UVB &amp; blue light protection. Hyaluronic Acid Deeply hydrates skin to heal dry, rough patches. Blueberry Antioxidant-rich, it checks free radical damage for healthy skin texture. Aqua, Ethylhexyl Methoxycinnamate (and) Butyl Methoxydibenzoylmethane (and) Benzophenone-3 (and) Phospholipids (and) 1,3-Butylene Glycol, Propanediol, Sodium Acrylates Copolymer (and) Lecithin, C12-15 Alkyl Benzoate, Caprylic/Capric Triglyceride, Cyclopentasiloxane, Glycerine, Propylene Glycol, Diethylamino Hydroxybenzoyl Hexyl Benzoate, Ethylhexyl Salicylate, Methylene Bis-Benzotriazolyl Tetramethylbutylphenol (and) Aqua [and] Decyl Glucoside (and) Propylene Glycol (and) Xanthan Gum, Xylitylglucoside (and) Anhydroxylitol (and) Xylitol, Glyceryl Monostearate, Cetearyl Alcohol, Sodium Polyacrylate (and) Dimethicone (and) Cyclopenta- siloxane (and) Trideceth-6 (and) PEG/PPG-18/18 Dimethicone, Titanium Dioxide (and) Silica, Allantoin, Sodium Gluconate, Disodium EDTA, Tocopheryl Acetate, Lactococcus Ferment Lysate, Laminaria Digitata Extract (and) Hydrogenated Lecithin (and) Cetyl-PG Hydroxyethyl Palmitamide (and) Ceramide 1, 2,3,4,6|| [and] Cholesterol (and) 1,2-hexanediol, Sodium Hyaluronate, Aqua (and) Oryza Sativa (Rice) Extract (and) Saccharomyces ferment lysate filtrate (and) Citric acid (and) Sodium Benzoate (and) Potassium sorbate, Glycerin (and) Aqua (and) Butylene Glycol (and) Carbomer (and) Polysorbate 20 (and) Palmitoyl Tripeptide-1 (and) Palmitoyl Tetrapeptide-7, Glycerin [and] Aqua (and) Vaccinium Angustifolium (Blueberry) Fruit Extract, Phenoxyethanol (and) Ethylhexylglycerin. Use 15 minutes before stepping out. Apply on face, neck &amp; other body parts. Re-apply every 2-3 hours. Plays well under makeup PRO TIP: Use it even when indoors, or out on a cloudy day. Routine for Healthy, Hydrated Skin most loved Sunscreens Products Skin Type texture FINISH benefit water resistant FRAGRANCE blueberry Sunscreen All Skin Types Water Cream Natural Repairs Skin Barrier 80 mins Vitamin C+E Sunscreen All Skin Types Water-Light Fluid Dewy Boosts Glow 80 mins Watermelon Sunscreen Oily &amp; Combination Aqua gel Non-Oily Instantly Cools Skin 80 mins Strawberry Dew Sunstick All Skin Types Air-Light Invisible Easy Re-application 120 mins Our Sunscreen Promise No White Cast No Pilling Non Comedogenic Does Not Sting Eyes Fragrance Free Light Weight Q1. Will the sunscreen feel heavy on my skin? A. No. Our Barrier Repair Sunscreen features a water-cream texture. This unique texture comes out as a cream from the tube &amp; breaks into a watery consistency when applied to the skin. It is extremely lightweight &amp; quick-absorbing that leaves your skin feeling hydrated without any heaviness, stickiness or greasiness. Q2. Can someone with normal skin use this sunscreen? A. Yes. Our sunscreen has been specially designed for dry &amp; sensitive skin. However, it also works great on normal skin. Q3. Suggest a complete routine with this sunscreen. A. Barrier Repair Face Wash-&gt; Rice Water Toner-&gt; Hydrating Face Serum-&gt; Barrier Repair Face Cream/72Hr Probiotics Gel-&gt; Barrier Repair SPF 50+ Sunscreen. Note: Use Barrier Repair Sunscreen if you have dry, sensitive skin. If you are looking for light moisturisation, use 72Hr Probiotics Gel which is great for oily &amp; combination skin. Q4. How soon will I see the result? A. Use this sunscreen daily, even on a cloudy day &amp; when indoors, for best results. Q5. Will this sunscreen sting my eyes? A. No. All our sunscreens are free from allergens &amp; irritants that cause zero eye irritation. Suggested Rituals #redirect_product { cursor: pointer; }"
