SKU,Title,Variant,Type,Tags (Features/Applications),Price,Compare At Price,Description (Use/Features)
DK_MNPLGM,72HR Hydrating Gel Moisturizer - 15ML-FREE,15ml,Free,not-searchable,195.00,195.00,"Light, oil-free daily moisturiser infused with Japanese Rice Water, Pre &amp; Probiotics, Kombucha and Hyaluronic Acid, it is clinically proven to hydrate skin for 72 hours, leaving it plump, dewy and bouncy with an improved skin texture. Formulated with a combination of low and high molecular weight Hyaluronic Acid, Kombucha, Fermented Rice Water, and Probiotics. Improves skin’s natural ecosystem of good bacteria that is necessary for great skin health. Provides 72 HR long lasting hydration to the skin. Strengthens the moisture barrier of the skin and shields it from environmental aggressors like UV rays and pollutants, resulting in plump, dewy and glowing skin. Wh o It's Good For Skin Types Oily Combination Normal Congested Concerns Dry Skin Dehydrated Skin Dull Skin Uneven Skin tone Key Ingredients All Ingredients: Aqua, Cyclopentasiloxane, Dimethicone Crosspolymer, Glycerin, Polyacrylamide (and) C13-14 Isoparaffin (and) Laureth-7, Divinyldimethicone/Dimethicone Copolymer (and) C12-13 Pareth-23 (and) C12-13 Pareth-3, Silanetriol (and) Hyaluronic Acid, Dimethylsilanol Hyaluronate, Saccharide Isomerate, Methylsilanol Mannuronate, Methylisothiazolinone (and) Phenoxyethanol, Acrylates/C10-30 Alkyl Acrylate Crosspolymer, Disodium EDTA, Lactobacillus (and) Maltodextrin, Sodium Hydroxide, CI 42090, Perfume, Pyrus Malus (Apple) Fruit Extract, Avena Sativa (Oat) Kernel Extract, Kombucha, Rice Water. The Experience The Scent - Floral &amp; Fruity The Texture - Gel Like Makes Skin Feel - Soft, Smooth, Even &amp; Plump Makes Skin Look - Healthy, Bright, Smooth, Dewy &amp; Hydrated How To Use 1. Dot the gel on your face and neck, and massage in an upward motion. 2. Use daily in the morning and evening, after your serum. 3. Can be used under your makeup. Faq Q. Can this be used in the day time? A. If used during the day, please follow with adequate amount of sunscreen Q. Is this a natural exfoliator? A. Yes! The AHA in the product is derived from sugarcane, green apple, grapefruit and citrus."
DK_NVWGFCDK_WSGSDK_WCIGMDK_WMCS,Watermelon Oil Free Skin Combo,180ml,Combo,"_allproducts, _combo-product, _Face Wash, Combination Skin, combo, ex-app, full package, label_25_off_combo25, label_buy_1_get_1, Moisturizer, Oily Skin, Serums And Oils, skinconcern_Clogged Pores, skinconcern_Open Pores, skinconcern_Pore Care, skintype_Combination, skintype_Oily, st_ingredients_watermelon, st_skin_type_combination, st_skin_type_oily, st_skinconcern_excess_oil, Sunscreen, texture, Uneven Tone",1788.00,1788.00,
DK_WCIGMDK_WMCS,Instant Cooling Watermelon Duo,90ml,Combo,"_allproducts, _combo-product, _daily, _Face Care, BBB TOP PICK, bundle, category_Singles, combo, combos, Daily Essentials, Dry Skin, exclusion_app, flat20, fltr_dnk_best_selling_Best-Selling, fltr_ingredients_Retinol, fltr_skin_type_Boosts Collagen, fltr_skin_type_Firms Skin, fltr_skin_type_Moisturizes, label_buy_1_get_1, moisture, Moisturizer, mosturiser, mosturizer, Normal Skin, score:2, skinconcern_Dryness, skintype_Dry, st_skin_type_normal, st_skin_type_oily, texture, valentine, watermelon, winter-pick",940.00,940.00,
DK_BROFM50,Barrier Repair Oil-Free Moisturizer with Ceramides,50g,Moisturiser,"_allproducts, _Newarrivals, Combination Skin, flat20, fltr_dnk_best_selling_Best-Selling, fltr_dnk_new_arrival_dnk-new-arrival, fltr_skin_concern_Dryness, fltr_skin_type_Combination, fltr_skin_type_Dry, fltr_skin_type_Normal, fltr_skin_type_Sensitive, hyluronic, label_15_off_flat15, label_buy_1_get_1, moisture, Moisturizer, moisturizer_combination, moisturizer_day, moisturizer_dry, moisturizer_dryness, moisturizer_night, moisturizer_normal, moisturizer_notsure, moisturizer_oily, moisturizer_sensitive, mosturiser, mosturizer, NewYearStore_, Normal Skin, Offer popup, orbo_shine, score:9999999, Sensitive Skin, shine, skinconcern_Dehydrated, skinconcern_Dryness, skintype_Dry, skintype_Sensitive, st_ingredients_blueberry, st_ingredients_ceramides, st_ingredients_hyaluronic, st_skin_type_combination, st_skin_type_normal, st_skin_type_oily, st_skin_type_sensitive, st_skinconcern_excess_oil, Uneven Tone, uneven_skin",399.00,399.00,
DK_CNGSDK_CNOM,Peace Out Acne Super Cica Duo,90ml,Combo,"_allproducts, _combo-product, Acne Control, Acne Prone Skin, activeAcne, BBB TOP PICK, category_Singles, CICA, Cica+Niacinamide, combo, combos, exclusion_app, flat20, fltr_ingredients_Niacinamide + Cica, fltr_skin_concern_Acne, fltr_skin_concern_Dark Spots, fltr_skin_concern_Excess Oil, fltr_skin_concern_Others, fltr_skin_type_Oily, fltr_skin_type_Sensitive, hyluronic, kojic, label_15_off_flat15, label_buy_1_get_1, moisture, Moisturizer, mosturiser, mosturizer, Oily Skin, pimple, postAcne, proneAcne, Score:63, Sensitive Skin, skinconcern_Acne, skintype_Oily, skintype_Sensitive, st_ingredients_cica, st_ingredients_hyaluronic, st_skin_type_normal, st_skin_type_oily, st_skin_type_sensitive, st_skinconcern_acne, st_skinconcern_dark_spots, Summer Picks",1094.00,1094.00,
DK_NRSTDK_PYRS,Forever Young Retinol Power Duo,90ml,Combo,"_allproducts, _combo-product, _daily, _Face Care, Age Defense, BBB TOP PICK, bundle, category_Singles, combo, combos, Daily Essentials, Dry Skin, exclusion_app, flat20, fltr_dnk_best_selling_Best-Selling, fltr_ingredients_Retinol, fltr_skin_type_Combination, fltr_skin_type_Normal, fltr_skin_type_Oily, label_buy_1_get_1, Mature Skin, moisture, Moisturizer, mosturiser, mosturizer, Normal Skin, retinol, score:2, skinconcern_Dryness, skinconcern_Fine Lines and Wrinkles, skintype_Dry, st_ingredients_pomegranate, st_ingredients_retinol, st_skin_type_normal, st_skin_type_oily, st_skinconcern_ageing, valentine, winter-pick",1198.00,1198.00,
DK_SDSM,Strawberry Sunscreen Face Mist In-Vivo Tested SPF 50+ PA+++,80ml,Sunscreen,"_allproducts, _newlaunch, body mist, Combination Skin, dark_spots, Dewy, Dry Skin, Dullness, flat20, fltr_dnk_new_arrival_dnk-new-arrival, kojic, label_15_off_flat15, label_buy_1_get_1, Normal Skin, Offer popup, Oily, score:9999, st_skin_type_combination, st_skin_type_normal, sun screen, suncream, suncreen, Sunscreen",599.00,599.00,
DK_SBNS,Strawberry Bright 10% Niacinamide Face Serum,30ml,Serum,"_allproducts, _Best Sellers, _newlaunch, Combination Skin, Dark Spots, dark_spots, Dry Skin, fltr_dnk_new_arrival_dnk-new-arrival, glass serum, glutathione serum, label_buy_1_get_1, NewYearStore_, Normal Skin, Oily Skin, orbo_dark_spots, Pigmentation, serum, serum_age, serum_combination, serum_dry, serum_normal, serum_oily, serum_sensitive, serum_wrinkle, Serums And Oils, Skin Glow, skin_dullness, skinconcern_Clogged Pores, skinconcern_Open Pores, skinconcern_Pore Care, st_ingredients_niacinamide, st_ingredients_strawberry, st_skin_type_combination, st_skin_type_normal, st_skin_type_oily, st_skin_type_sensitive, st_skinconcern_dullness, st_skinconcern_pigmentation",599.00,599.00,
DK_MNSBNS,Strawberry Bright 10% Niacinamide Face Serum,20ml,Serum,"_allproducts, _Best Sellers, _newlaunch, Combination Skin, Dark Spots, dark_spots, Dry Skin, fltr_dnk_new_arrival_dnk-new-arrival, glass serum, glutathione serum, label_buy_1_get_1, NewYearStore_, Normal Skin, Oily Skin, orbo_dark_spots, Pigmentation, serum, serum_age, serum_combination, serum_dry, serum_normal, serum_oily, serum_sensitive, serum_wrinkle, Serums And Oils, Skin Glow, skin_dullness, skinconcern_Clogged Pores, skinconcern_Open Pores, skinconcern_Pore Care, st_ingredients_niacinamide, st_ingredients_strawberry, st_skin_type_combination, st_skin_type_normal, st_skin_type_oily, st_skin_type_sensitive, st_skinconcern_dullness, st_skinconcern_pigmentation",449.00,449.00,
DK_CCNS2,SPF 50+ Cica & Niacinamide Sunscreen 50g - Pack of 2,100g,Combo,"_allproducts, _combo-product, _Sun Care, Acne Control, Acne Prone Skin, BBB TOP PICK, CICA, cica+niacinamide, combo, exclusion_app, flat20, fltr_ingredients_Niacinamide + Cica, fltr_skin_concern_Acne, fltr_skin_concern_Dark Spots, fltr_skin_concern_Others, fltr_skin_type_Combination, fltr_skin_type_Normal, fltr_skin_type_Oily, fltr_skin_type_Sensitive, kojic, label_buy_1_get_1, pimple, score:59, Sensitive Skin, skinconcern_Acne, skintype_Oily, st_ingredients_cica, st_skin_type_oily, st_skin_type_sensitive, st_skinconcern_acne, st_skinconcern_dark_spots, sun screen, suncream, suncreen, Sunscreen",890.00,890.00,
DK_WCIGM,Watermelon Cooling Icy Gel Moisturizer With Hyaluronic,60g,Moisturiser,"_allproducts, _daily, _Face Care, Combination Skin, exclusion_app, fltr_dnk_new_arrival_dnk-new-arrival, label_buy_1_get_1, moisture, Moisturizer, moisturizer_combination, moisturizer_day, moisturizer_dry, moisturizer_night, moisturizer_normal, moisturizer_notsure, moisturizer_oil, moisturizer_oily, moisturizer_sensitive, mosturiser, mosturizer, Normal Skin, Oily Skin, orbo_shine, orbo_smoothness, orbo_texture, orbo_uneven_skin, score:2, shine, skinconcern_Dullness, skinconcern_Uneven Skin Tone, skintype_Combination, skintype_Oily, smoothness, st_ingredients_glycolic, st_ingredients_hyaluronic, st_ingredients_watermelon, st_skin_type_combination, st_skin_type_normal, st_skin_type_oily, st_skinconcern_excess_oil, Summer Picks, texture, Uneven Tone, uneven_skin, valentine, watermelon, winter-pick",495.00,495.00,
DK_NVMDGS,"Mango Detan Sunscreen, In-Vivo Tested SPF 50+ PA++++",80g,Sunscreen,"_allproducts, _newlaunch, Combination Skin, fltr_dnk_new_arrival_dnk-new-arrival, label_buy_1_get_1, NewYearStore_, Normal Skin, Oily Skin, st_ingredients_mango, st_skin_type_combination, st_skin_type_normal, st_skin_type_oily, st_skin_type_sensitive, Sunscreen, sunscreen_combination, Sunscreen_dewy, sunscreen_dry, sunscreen_matte, Sunscreen_natural, sunscreen_normal, sunscreen_notsure, sunscreen_oilfree, Sunscreen_oily, sunscreen_sensitive, sunscreen_tan",595.00,595.00,
DK_MDGS,"Mango Detan Sunscreen, In-Vivo Tested SPF 50+ PA++++",50g,Sunscreen,"_allproducts, _newlaunch, Combination Skin, fltr_dnk_new_arrival_dnk-new-arrival, label_buy_1_get_1, NewYearStore_, Normal Skin, Oily Skin, st_ingredients_mango, st_skin_type_combination, st_skin_type_normal, st_skin_type_oily, st_skin_type_sensitive, Sunscreen, sunscreen_combination, Sunscreen_dewy, sunscreen_dry, sunscreen_matte, Sunscreen_natural, sunscreen_normal, sunscreen_notsure, sunscreen_oilfree, Sunscreen_oily, sunscreen_sensitive, sunscreen_tan",445.00,445.00,
DK_PYRS,Pomegranate Youth 0.2% Retinol Complex Face Serum,30ml,Serum,"_allproducts, Age Defense, Combination Skin, Dry Skin, face_wrinkles, firmness, fltr_dnk_new_arrival_dnk-new-arrival, gpay_30_percent, label_buy_1_get_1, NewYearStore_, Normal Skin, Oily Skin, orbo_face_wrinkles, orbo_firmness, orbo_smoothness, serum, serum_age, serum_combination, serum_dry, serum_normal, serum_oily, serum_sensitive, serum_wrinkle, Serums And Oils, skinconcern_Clogged Pores, skinconcern_Open Pores, skinconcern_Pore Care, st_ingredients_pomegranate, st_ingredients_retinol, st_skin_type_combination, st_skin_type_normal, st_skin_type_oily, st_skin_type_sensitive, st_skinconcern_ageing",599.00,599.00,
DK_FNVVCEM2,"Vitamin C + E Moisturizer, Pack of 2",120ml,Combo,"_allproducts, _combo-product, BBB TOP PICK, bundle, category_Singles, Combination Skin, combo, combos, Dry Skin, enable-pmslider, exclusion_app, flat20, fltr_dnk_best_selling_Best-Selling, fltr_ingredients_Vitamin C, fltr_skin_concern_Dark Spots, fltr_skin_concern_Dullness, fltr_skin_concern_Pigmentation/Uneven Skin Tone, fltr_skin_type_Combination, fltr_skin_type_Normal, fltr_skin_type_Oily, kojic, label_15_off_flat15, label_buy_1_get_1, moisture, Moisturizer, mosturiser, mosturizer, Normal Skin, Offer popup, Oily Skin, Pigmentation, score:9995, Skin Glow, skinconcern_Dullness, skinconcern_Uneven Skin Tone, skintype_Dry, skintype_Oily, st_ingredients_blood_orange, st_ingredients_vitamin_c, st_skin_type_combination, st_skin_type_normal, st_skin_type_oily, st_skinconcern_dullness, st_skinconcern_pigmentation, winter-pick",990.00,990.00,"Daily use moisturizer for even-toned, visibly glowing skin Infused with Triple Vitamin C, Sicilian Blood Orange &amp; Shea Butter Helps reduce dullness , treats pigmentation &amp; fades dark spots Also provides healthy, non-sticky moisturization for soft skin Lightweight &amp; non-comedogenic , it's suitable for oily, combination &amp; normal skin Lightweight Moisturizes Non-Sticky Normal, Oily, Combination Skin Clinical Results Clinical Results blue 35 Increase in skin brightness in just 4 weeks 111 Increase in Skin Moisturization in just 2 weeks *Based on an independent study conducted on 36 women over a period of 4 weeks Results In Visibly Glowing &amp; Moisturized Skin Results In Visibly Glowing &amp; Moisturized Skin why you’ll it Boosts glow Non-sticky moisturization Fades dark spots Visibly even-toned skin Non-comedogenic Targets Dullness Pigmentation Dark Spots Great For Normal, Oily &amp; Combination Skin Not Suitable For Dry Skin Triple Vitamin C With 3 types of Vitamin C, it reduces dullness, pigmentation &amp; dark spots Sicilian Blood Orange Antioxidant-rich, it minimizes free radical damage Vitamin E Protects skin from external aggressors for a healthy skin texture Shea Butter Deeply moisturizes &amp; locks it in for soft, supple skin Old Formulation: Aqua, Dicaprylyl Ether, Glycerine, Dimethicone, Butyrospermum Parkii (Shea) Butter, Xylitylglucoside (and) Anhydroxylitol (and) Xylitol, Polyacrylate Crosspolymer-6, Acrylates/C10-30 Alkyl Acrylate Crosspolymer, Cetearyl Alcohol, Ethyl Ascorbic Acid, Acacia Senegal Gum (and) Xanthan Gum, Niacinamide, Saccharide Isomerate (and) Citric Acid (and) Sodium Citrate, Allantoin, Panthenol, Tocopheryl Acetate, Methylsilanol Mannuronate, Sodium Hydroxide, Disodium EDTA, Betaine, Citrus Sinensis (Blood Orange) Fruit Extract, Glycerin (and) Water (and) Terminalia Ferdinandiana Fruit Extract, Rosa Rubiginosa (Rosehip) Seed Oil, Phenoxyethanol (and) Ethylhexylglycerin, Pentaerythrityl Tetra-di-t-butyl Hydroxyhydrocinnamate, Butylated Hydroxytoluene, Fragrance*, CI 15985, CI 19140 . * IFRA Certified. Dot the moisturizer on clean face &amp; neck Massage gently in an upward motion Use daily for AM &amp; PM routine Follow up with SPF during daytime PRO TIP: Works as a wonderful makeup base. Suggested Routine for glowing Skin More From Lightweight Moisturizers Products Ideal Skin Type Texture What it does Vitamin C+E Moisturizer Normal, Oily &amp; Combination Sorbet Boosts Skin Glow Barrier Repair Moisturizer Normal, Dry, Sensitive &amp; Combination Smooth Repairs skin barrier Cica Moisturizer Oily &amp; Acne Prone Skin Ultra Light, Water Gel Reduces acne &amp; acne scars 72HR Gel Moisturizer Oily &amp; Combination Oil-Free, Water Gel 72HR non stop hydration Clean Formulations Cleaner Ingredients MINERAL OIL FREE PARABEN FREE ESSENTIAL OIL FREE SULPHATE FREE GMO FREE CRUELTY FREE Q. What are the 3 types of vitamin C present in this cream? A. This daily moisturizer is infused with 3 types of vitamin C from Kakadu Plum (the highest source of natural vitamin C), Ethyl Ascorbic Acid (type A vitamin C) &amp; Sicilian Blood Orange to give you even-toned, visibly glowing skin. Q. What are the benefits of the 3 types of vitamin C? A. 100% natural vitamin C helps boost brightness for healthy, glowing skin. Ethyl Ascorbic Acid helps fade hyperpigmentation &amp; dark spots. Sicilian Blood Orange reduces free radical damage to improve the overall health of the skin. Q. Will it provide enough hydration for my dry skin? A. Yes. Our vitamin C+E super-bright moisturizer is infused with shea butter that replenishes your skin's moisture level &amp; locks in moisture for hydrated, soft skin. Q. How soon will the result show up? A. The results start showing up within 2 weeks when used regularly. Q. Is this moisturizer safe for pregnant &amp; lactating women? A. Yes. Our Vitamin C Moisturizer is safe for pregnant &amp; lactating women. Suggested Rituals .skin-type-flex-item.skin-banner { width: 40%; } .detail-menu { max-width: 100% !important; gap: 0px !important; } .detail-menu .detail-menu-item { border: none !important; border-bottom: 2px solid rgb(184, 184, 184) !important; border-radius: 0px !important; background: transparent !important; } .detail-menu .detail-menu-item.active { color: #000; border: none !important; border-bottom: 2px solid rgb(0, 0, 0) !important; } body .skin-type-overlap { margin-top: -80px; } .most-loved-table td:nth-child(2) { overflow: hidden !important; } .most-loved-table td:nth-child(2) img { transform: scale(1.2) !important; } .inner-flex-item div[role=progressbar]:before { font-family: 'Tiempos Medium Italics' !important; } #redirect_product { cursor: pointer; } @media (max-width: 1279px) { .skin-type-flex-item.skin-banner { width: 55% !important; } } @media (min-width: 1200px) { .img-section { width: 55% !important; } body .detail-head { font-size: 30px !important; } .detail-list li { font-size: 22px !important; } .skin-type-flex-item.skin-banner { margin-right: 8% !important; } } @media (max-width: 1024px) { .clinical-flex-item.flex-banner-desk img { max-width: 450px !important; } } @media (max-width: 786px) { body .clinical-flex-item.flex-banner-mob .clinical-title { display: block !important; margin-bottom: 10px !important; } body .clinical-flex .clinical-flex-item .clinical-heading { display: none !important; } .revised-price { justify-content: center !important; } body .detail-head { font-size: 22px !important; } body .detail-list li { font-size: 18px !important; } } @media (max-width: 480px) { .skin-type-flex-item.skin-banner img { margin-top: 10% !important; } body .skin-type-overlap { margin-top: -25px !important; } body .clinical-flex-item.flex-banner-mob .clinical-title { display: block !important; } body .clinical-flex .clinical-flex-item .clinical-heading { display: none !important; } } @media (max-width: 426px) { body .skin-type-overlap { margin-top: -6% !important; } .detail-menu .detail-menu-item { font-size: 10px !important; } .clean-banner .layering-head { font-size: 16px !important; } .revised-price { justify-content: center !important; } .product__policies.rte { text-align: center !important; } body .detail-head { font-size: 22px !important; } body .detail-list li { font-size: 18px !important; } body .content-section { margin: 0 !important; } body .clinical-flex-item.flex-banner-mob .clinical-title { display: block !important; margin-bottom: 10px !important; } body .clinical-flex .clinical-flex-item .clinical-heading { display: none !important; } body .proTip { font-size: 14px !important; } } @media(max-width: 390px) { body .skin-type-overlap { margin-top: -5% !important; } .variantMakeItOpt { justify-content: center !important; } } @media(max-width: 376px) { body .skin-type-overlap { margin-top: -5% !important; } .tPfistPartCVIT-C, .bTfistPartCVIT-C { font-size: 13px !important; } .overlap-head, .bTsndPartCVIT-C { font-size: 15px !important; } .variantMakeItOpt { justify-content: center !important; } } @media (max-width: 360px) { body .most-loved-table td { height: 90px !important; } .variantMakeItOpt { justify-content: center !important; } }"
DK_SDDM2,"Strawberry + Niacinamide Moisturizer, Pack of 2",160gm,Combo,"_allproducts, _combo-product, _newlaunch, Combination Skin, combo, combos, Dry Skin, label_15_off_flat15, label_buy_1_get_1, Moisturizer, Normal Skin, Oily Skin, st_ingredients_strawberry, st_skin_type_combination, st_skin_type_dry, st_skin_type_normal",798.00,798.00,
DK_NRST2,"Retinol + Ceramide Night Cream, Pack of 2",120ml,Combo,"_allproducts, _combo-product, _daily, _Face Care, Age Defense, BBB TOP PICK, bundle, category_Singles, combo, combos, Daily Essentials, Dry Skin, exclusion_app, flat20, fltr_dnk_best_selling_Best-Selling, fltr_ingredients_Retinol, fltr_skin_concern_Ageing, fltr_skin_concern_Dullness, fltr_skin_type_Combination, fltr_skin_type_Normal, fltr_skin_type_Oily, label_buy_1_get_1, Mature Skin, moisture, Moisturizer, mosturiser, mosturizer, Normal Skin, retinol, score:2, skinconcern_Dryness, skinconcern_Fine Lines and Wrinkles, skintype_Dry, st_ingredients_pomegranate, st_ingredients_retinol, st_skin_type_normal, st_skin_type_oily, st_skinconcern_ageing, valentine, winter-pick",1198.00,1198.00,"Ultimate age-defying night cream for firm, youthful &amp; radiant skin. Supercharged with retinol, ceramide &amp; pomegranate for visible results. Reduces fine lines &amp; wrinkles for smoother skin. Preserves skin firmness &amp; elasticity while adding youthful radiance. Non-comedogenic night cream that locks in moisture to prevent dryness. Boosts Collagen Firms Skin Lightweight Normal, Oily &amp; Combination Skin Clinically Proven Clinically Proven melon Clinically Proven 37 increase in skin smoothness in 8 just weeks *Based on a clinical study conducted by Mascot Spincontrol on 36 female subjects Results In Firm, Youthful &amp; Radiant Skin Results In Firm, Youthful &amp; Radiant Skin Why you’ll It Smoothes fine lines &amp; wrinkles Locks in moisture Boosts collagen &amp; firms skin Preserves youthful radiance Non-comedogenic Targets Fine Lines &amp; Wrinkles Loss of Skin Elasticity Uneven Skin Texture Great For: Normal, Oily &amp; Combination Skin Not Suitable For: Very Dry Skin Retinol Proven to reduce fine lines &amp; wrinkles while boosting collagen Pomegranate Antioxidant-rich superfruit, it adds youthful radiance to your skin Ceramide Locks in moisture to prevent dryness &amp; boosts skin barrier Test Aqua, Glycerine, Dicaprylyl Ether, Dimethicone (and) Dimethicone Crosspolymer, Polyacrylamide (and) C13-14 Isoparaffin (and) Laureth-7, Methylsilanol Mannuronate, Retinyl Palmitate (Retinol Ester), Silanetriol (and) Hyaluronic Acid, Hibiscus Sabdariffa Flower Extract, Punica Granatum (Pomegranate) Seed Oil, Oenothera Biennis (Evening Primrose) Oil, Laminaria Digitata Extract (and) Cetyl - PG Hydroxyethyl Palmitamide (and) Ceramide 1 (and) Ceramide 2 (and) Ceramide 3 (and) Ceramide 4 (and) Ceramide 6 II, Acrylates/C10-30 Alkyl Acrylate Crosspolymer, Tocopheryl Acetate, Sodium Hydroxide, Panthenol, Allantoin, Disodium EDTA, Benzyl Alcohol (and) Ethylhexylglycerin (and) Tocopherol, IFRA Certified Allergen Free Fragrance, CI 16185, CI 15985, CI 42090 Dot the cream on clean face &amp; neck Massage in an upward motion Use daily for PM results Follow up with sunscreen the next day Dot the cream on clean face &amp; neck Massage in an upward motion Use daily for PM results Follow up with sunscreen the next day Suggested Routine for Youthful Skin More From Lightweight Moisturizers Products Ideal Skin Type Texture What it does Retinol Night Cream Oily, Combination &amp; Normal Creamy Smoothes fine lines &amp; wrinkles Vitamin C+E Moisturizer Normal, Oily &amp; Combination Sorbet Boosts Skin Glow Barrier Repair Moisturizer Normal, Dry, Sensitive &amp; Combination Smooth Repairs skin barrier Cica Moisturizer Oily &amp; Acne-Prone Skin Ultra-Light, Water Gel Reduces acne &amp; acne scars Clean Formulations Cleaner Ingredients MINERAL OIL FREE PARABEN FREE ESSENTIAL OIL FREE Sulphate Free Alcohol Free Cruelty Free Q. What does retinol night cream do? A. Our retinol night cream works as an overnight treatment to treat fine lines &amp; wrinkles while boosting collagen for firm, smooth &amp; youthful skin. It also moisturizes to heal dryness. Q. Can I use it every night? A. Yes, you can. However, make sure to apply sunscreen the next day to prevent sun sensitivity for your skin. Q. What actives should I not use retinol? A. Retinol should not be used with vitamin C, benzoyl peroxide, or AHA/BHA acids in the same skincare routine. Q.Does this cause any skin purging or irritation? A. No. Our retinol night cream is mild yet effective. It is non-comedogenic which does not clog pores or cause any sort of skin irritation. It also contains ceramides which helps with locking in moisture. Q. Can I use vitamin C face cream or moisturizer in the morning and retinol at night? A. Yes you can. While Vitamin C Moisturizer will help fight dullness &amp; dark spots, Retinol Night Cream will improve cell turnover to preserve youthful skin. Suggested Rituals #redirect_product { cursor: pointer; } #clinical-claim-header { display: none; } .clinical-4849621237892 .mascot-des{ display: none !important; }"
